{
  "id": "two-sum",
  "title": "Two Sum",
  "difficulty": "Easy",
  "description": "Given an array of integers nums and an integer target, return indices of the two numbers such that they add up to target.\n\nYou may assume that each input would have exactly one solution, and you may not use the same element twice.\n\nYou can return the answer in any order.",
  "examples": [
    {
      "input": "nums = [2,7,11,15], target = 9",
      "output": "[0,1]",
      "explanation": "Because nums[0] + nums[1] == 9, we return [0, 1]."
    },
    {
      "input": "nums = [3,2,4], target = 6",
      "output": "[1,2]"
    }
  ],
  "constraints": [
    "2 <= nums.length <= 10^4",
    "-10^9 <= nums[i] <= 10^9",
    "-10^9 <= target <= 10^9",
    "Only one valid answer exists."
  ],
  "input": {
    "nums": {
      "type": "array",
      "childType": {
        "type": "number"
      },
      "description": "An array of integers where each element is between -10^9 and 10^9."
    },
    "target": {
      "type": "number",
      "description": "A number between -10^9 and 10^9 representing the target sum."
    }
  },
  "output": {
    "type": "array"
  },
  "functionName": "twoSum",
  "executionMode": "return",
  "comparisonMode": "ordered",
  "testCases": [
    {
      "input": {
        "nums": [2, 7, 11, 15],
        "target": 9
      },
      "expected": [0, 1]
    },
    {
      "input": {
        "nums": [3, 2, 4],
        "target": 6
      },
      "expected": [1, 2]
    },
    {
      "input": {
        "nums": [3, 3],
        "target": 6
      },
      "expected": [0, 1]
    },
    {
      "input": {
        "nums": [1, 2, 3, 4, 5],
        "target": 9
      },
      "expected": [3, 4]
    },
    {
      "input": {
        "nums": [0, 4, 3, 0],
        "target": 0
      },
      "expected": [0, 3]
    }
  ],
  "solutions": [
    {
      "id": 1,
      "title": "Brute Force",
      "description": "A simple brute force solution that checks every pair of numbers to find the indices that sum to the target.",
      "timeComlexity": "O(n^2)",
      "spaceComplexity": "O(1)",
      "solution": {
        "python": "ZGVmIHR3b1N1bShzZWxmLCBudW1zOiBMaXN0W2ludF0sIHRhcmdldDogaW50KSAtPiBMaXN0W2ludF06CiAgICAgICAgZm9yIGkgaW4gcmFuZ2UobGVuKG51bXMpKToKICAgICAgICAgICAgZm9yIGogaW4gcmFuZ2UoaSArIDEsIGxlbihudW1zKSk6CiAgICAgICAgICAgICAgICBpZiBudW1zW2ldICsgbnVtc1tqXSA9PSB0YXJnZXQ6CiAgICAgICAgICAgICAgICAgICAgcmV0dXJuIFtpLCBqXQogICAgICAgIHJldHVybiBbXQ==",
        "javascript": "ZnVuY3Rpb24gdHdvU3VtKG51bXMsIHRhcmdldCkgewogICAgICAgIGZvciAobGV0IGkgPSAwOyBpIDwgbnVtcy5sZW5ndGg7IGkrKykgewogICAgICAgICAgICBmb3IgKGxldCBqID0gaSArIDE7IGogPCBudW1zLmxlbmd0aDsgaisrKSB7CiAgICAgICAgICAgICAgICBpZiAobnVtc1tpXSArIG51bXNbal0gPT09IHRhcmdldCkgewogICAgICAgICAgICAgICAgICAgIHJldHVybiBbaSwgal07IAogICAgICAgICAgICAgICAgfQogICAgICAgICAgICB9CiAgICAgICAgfQogICAgICAgIHJldHVybiBbXTsKICAgIH0="
      }
    },
    {
      "id": 2,
      "title": "Hash Map",
      "description": "A more efficient solution using a hash map to store the indices of the numbers, allowing for O(n) time complexity.",
      "timeComlexity": "O(n)",
      "spaceComplexity": "O(n)",
      "solution": {  
        "python": "ZGVmIHR3b1N1bShudW1zOiBMaXN0W2ludF0sIHRhcmdldDogaW50KSAtPiBMaXN0W2ludF06CiAgICBudW1fdG9faW5kZXggPSB7fQogICAgZm9yIGksIG51bSBpbiBlbnVtZXJhdGUobnVtcyk6CiAgICAgICAgY29tcGxlbWVudCA9IHRhcmdldCAtIG51bQogICAgICAgIGlmIGNvbXBsZW1lbnQgaW4gbnVtX3RvX2luZGV4OgogICAgICAgICAgICByZXR1cm4gW251bV90b19pbmRleFtjb21wbGVtZW50XSwgaV0KICAgICAgICBudW1fdG9faW5kZXhbbnVtXSA9IGkKICAgIHJldHVybiBbXQ==",
        "javascript": "ZnVuY3Rpb24gdHdvU3VtKG51bXMsIHRhcmdldCkgewogIGNvbnN0IG51bU1hcCA9IG5ldyBNYXAoKTsKICBmb3IgKGxldCBpID0gMDsgaSA8IG51bXMubGVuZ3RoOyBpKyspIHsKICAgIGNvbnN0IGNvbXBsZW1lbnQgPSB0YXJnZXQgLSBudW1zW2ldOwogICAgaWYgKG51bU1hcC5oYXMoY29tcGxlbWVudCkpIHsKICAgICAgcmV0dXJuIFtudW1NYXAuZ2V0KGNvbXBsZW1lbnQpLCBpXTsKICAgIH0KICAgIG51bU1hcC5zZXQobnVtc1tpXSwgaSk7CiAgfQogIHJldHVybiBbXTsKfQ=="
      }
    }
  ]
}
